Keyword,Title,Quora_link
Machine Learning,What are the advantages of different classification algorithms?,https://www.quora.com/What-are-the-advantages-of-different-classification-algorithms?
Machine Learning,"Since pro-gun people insist that assault weapon refers to fully automatic guns only, what is the proper gun classification name of semiautomatic rifles such as the AR15?","https://www.quora.com/Since-pro-gun-people-insist-that-assault-weapon-refers-to-fully-automatic-guns-only,-what-is-the-proper-gun-classification-name-of-semiautomatic-rifles-such-as-the-AR15?"
Machine Learning,What is classification?,https://www.quora.com/What-is-classification?
Machine Learning,What is the need of biological classification?,https://www.quora.com/What-is-the-need-of-biological-classification?
Machine Learning,What is the classification of amino acids?,https://www.quora.com/What-is-the-classification-of-amino-acids?
Machine Learning,What is the difference between Clustering and Classification in Machine Learning?,https://www.quora.com/What-is-the-difference-between-Clustering-and-Classification-in-Machine-Learning?
Machine Learning,Which criteria are used for the classification of plants? Explain with reasons?,https://www.quora.com/Which-criteria-are-used-for-the-classification-of-plants?-Explain-with-reasons?
Machine Learning,"In classification , how do you handle an unbalanced training set?","https://www.quora.com/In-classification-,-how-do-you-handle-an-unbalanced-training-set?"
Machine Learning,What are the advantages of classification?,https://www.quora.com/What-are-the-advantages-of-classification?
Machine Learning,Should Hispanics be considered part of the Caucasian racial classification in the US?,https://www.quora.com/Should-Hispanics-be-considered-part-of-the-Caucasian-racial-classification-in-the-US?
Machine Learning,What is the main difference between classification and regression problems?,https://www.quora.com/What-is-the-main-difference-between-classification-and-regression-problems?
Machine Learning,What is the need for the classification of elements?,https://www.quora.com/What-is-the-need-for-the-classification-of-elements?
Machine Learning,What is the classification of computer?,https://www.quora.com/What-is-the-classification-of-computer?
Machine Learning,What is the purpose of soil classification?,https://www.quora.com/What-is-the-purpose-of-soil-classification?
Machine Learning,What are the advantages of using a decision tree for classification?,https://www.quora.com/What-are-the-advantages-of-using-a-decision-tree-for-classification?
Machine Learning,Why is the classification of plants significant?,https://www.quora.com/Why-is-the-classification-of-plants-significant?
Machine Learning,What is the difference between unsupervised classification and supervised classification?,https://www.quora.com/What-is-the-difference-between-unsupervised-classification-and-supervised-classification?
Machine Learning,What is the main basis of classification in five kingdom classification?,https://www.quora.com/What-is-the-main-basis-of-classification-in-five-kingdom-classification?
Machine Learning,What are the best machine learning techniques for text classification?,https://www.quora.com/What-are-the-best-machine-learning-techniques-for-text-classification?
Machine Learning,What is the classification of engineering materials?,https://www.quora.com/What-is-the-classification-of-engineering-materials?
