Keyword,Title,Quora_link
Machine Learning,What are the advantages of logistic regression over decision trees?,https://www.quora.com/What-are-the-advantages-of-logistic-regression-over-decision-trees?
Machine Learning,Are there any cases where it's better to use logistic regression instead of decision trees?,https://www.quora.com/Are-there-any-cases-where-it's-better-to-use-logistic-regression-instead-of-decision-trees?
Machine Learning,What are the advantages of using a decision tree for classification?,https://www.quora.com/What-are-the-advantages-of-using-a-decision-tree-for-classification?
Machine Learning,What is an intuitive explanation of a decision tree?,https://www.quora.com/What-is-an-intuitive-explanation-of-a-decision-tree?
Machine Learning,What are the disadvantages of using a decision tree for classification?,https://www.quora.com/What-are-the-disadvantages-of-using-a-decision-tree-for-classification?
Machine Learning,What are some advantages of using neural networks over decision trees?,https://www.quora.com/What-are-some-advantages-of-using-neural-networks-over-decision-trees?
Machine Learning,How do random forests and boosted decision trees compare?,https://www.quora.com/How-do-random-forests-and-boosted-decision-trees-compare?
Machine Learning,How do decision trees for regression work?,https://www.quora.com/How-do-decision-trees-for-regression-work?
Machine Learning,What is the simple explanation of entropy as used in decision trees?,https://www.quora.com/What-is-the-simple-explanation-of-entropy-as-used-in-decision-trees?
Machine Learning,What are some advantages of using a random forest over a decision tree given that a decision tree is simpler?,https://www.quora.com/What-are-some-advantages-of-using-a-random-forest-over-a-decision-tree-given-that-a-decision-tree-is-simpler?
Machine Learning,What is a good Python library for decision trees?,https://www.quora.com/What-is-a-good-Python-library-for-decision-trees?
Machine Learning,When is the random forest better than decision tree?,https://www.quora.com/When-is-the-random-forest-better-than-decision-tree?
Machine Learning,"If deep learning is the future, what is the need for machine learning methods like SVM, decision trees , Bayesian methods, Markov chains, etc?","https://www.quora.com/If-deep-learning-is-the-future,-what-is-the-need-for-machine-learning-methods-like-SVM,-decision-trees-,-Bayesian-methods,-Markov-chains,-etc?"
Machine Learning,What are some good resources for learning about decision trees?,https://www.quora.com/What-are-some-good-resources-for-learning-about-decision-trees?
Machine Learning,What is a decision tree algorithm?,https://www.quora.com/What-is-a-decision-tree-algorithm?
Machine Learning,What are boosted decision trees?,https://www.quora.com/What-are-boosted-decision-trees?
Machine Learning,What is the difference between random forest and decision trees?,https://www.quora.com/What-is-the-difference-between-random-forest-and-decision-trees?
Machine Learning,Can decision trees implement both supervised and unsupervised learning?,https://www.quora.com/Can-decision-trees-implement-both-supervised-and-unsupervised-learning?
Machine Learning,How do I construct a decision tree?,https://www.quora.com/How-do-I-construct-a-decision-tree?
Machine Learning,Are decision trees AI?,https://www.quora.com/Are-decision-trees-AI?
Machine Learning,Decision Tree based models don't require scalingHow does scaling impact the predictions of decision tree based models?,https://www.quora.com/Decision-Tree-based-models-don't-require-scalingHow-does-scaling-impact-the-predictions-of-decision-tree-based-models?
Machine Learning,How do I implement a decision tree algorithm?,https://www.quora.com/How-do-I-implement-a-decision-tree-algorithm?
Machine Learning,When would you prefer decision tree over random forest?,https://www.quora.com/When-would-you-prefer-decision-tree-over-random-forest?
Machine Learning,Why do people use gradient boosted decision trees to do feature transform?,https://www.quora.com/Why-do-people-use-gradient-boosted-decision-trees-to-do-feature-transform?
Machine Learning,What are the decision trees in machine learning?,https://www.quora.com/What-are-the-decision-trees-in-machine-learning?
Machine Learning,What are some ways to make a decision tree better?,https://www.quora.com/What-are-some-ways-to-make-a-decision-tree-better?
Machine Learning,What is a decision tree?,https://www.quora.com/What-is-a-decision-tree?
Machine Learning,How should I solve this decision tree problem?,https://www.quora.com/How-should-I-solve-this-decision-tree-problem?
Machine Learning,Can we extract decision-tree like rules from neural networks?,https://www.quora.com/Can-we-extract-decision-tree-like-rules-from-neural-networks?
Machine Learning,What is a layman's explanation of how decision trees work?,https://www.quora.com/What-is-a-layman's-explanation-of-how-decision-trees-work?
Machine Learning,How practically relevant are classical machine learning algorithms like SVMs or decision trees as compared to deep learning?,https://www.quora.com/How-practically-relevant-are-classical-machine-learning-algorithms-like-SVMs-or-decision-trees-as-compared-to-deep-learning?
Machine Learning,Why are decision tree classifiers so popular?,https://www.quora.com/Why-are-decision-tree-classifiers-so-popular?
Machine Learning,Decision Trees : How do you prune a CART?,https://www.quora.com/Decision-Trees-:-How-do-you-prune-a-CART?
Machine Learning,"Why is gradient boosting used with decision trees so much, rather than with other classifiers?","https://www.quora.com/Why-is-gradient-boosting-used-with-decision-trees-so-much,-rather-than-with-other-classifiers?"
Machine Learning,Do different decision tree algorithms offer significant differences in performance?,https://www.quora.com/Do-different-decision-tree-algorithms-offer-significant-differences-in-performance?
Machine Learning,Why can decision trees handle unbalanced data for classification?,https://www.quora.com/Why-can-decision-trees-handle-unbalanced-data-for-classification?
Machine Learning,What is difference between Gini Impurity and Entropy in Decision Tree?,https://www.quora.com/What-is-difference-between-Gini-Impurity-and-Entropy-in-Decision-Tree?
Machine Learning,How do I prevent/avoid overfitting on my decision tree classifier (Sklearn)?,https://www.quora.com/How-do-I-prevent/avoid-overfitting-on-my-decision-tree-classifier-(Sklearn)?
Machine Learning,What is the difference between decision tree and decision tree regression?,https://www.quora.com/What-is-the-difference-between-decision-tree-and-decision-tree-regression?
Machine Learning,Is boosted decision tree different from gradient boosted decision tree?,https://www.quora.com/Is-boosted-decision-tree-different-from-gradient-boosted-decision-tree?
Machine Learning,Is multicollinearity a problem in decision trees?,https://www.quora.com/Is-multicollinearity-a-problem-in-decision-trees?
Machine Learning,What’s the difference between binary search trees and binary decision trees?,https://www.quora.com/What’s-the-difference-between-binary-search-trees-and-binary-decision-trees?
Machine Learning,What are the major flaws with decision trees?,https://www.quora.com/What-are-the-major-flaws-with-decision-trees?
Machine Learning,Why are categorical variables bad for decision trees?,https://www.quora.com/Why-are-categorical-variables-bad-for-decision-trees?
Machine Learning,What is a great browser-based tool for drawing decision trees?,https://www.quora.com/What-is-a-great-browser-based-tool-for-drawing-decision-trees?
Machine Learning,What is skewing in decision tree algorithm?,https://www.quora.com/What-is-skewing-in-decision-tree-algorithm?
Machine Learning,How can I use a decision tree to classify an unbalanced data set?,https://www.quora.com/How-can-I-use-a-decision-tree-to-classify-an-unbalanced-data-set?
Machine Learning,How does the decision tree solve XOr problems?,https://www.quora.com/How-does-the-decision-tree-solve-XOr-problems?
Machine Learning,How does the RIPPER decision tree algorithm work?,https://www.quora.com/How-does-the-RIPPER-decision-tree-algorithm-work?
Machine Learning,"Which one is better, Naive Bayes Algorithm or Decision Trees?","https://www.quora.com/Which-one-is-better,-Naive-Bayes-Algorithm-or-Decision-Trees?"
Machine Learning,Are decision tree algorithms artificial intelligence methods?,https://www.quora.com/Are-decision-tree-algorithms-artificial-intelligence-methods?
