Keyword,Title,Quora_link
Machine Learning,What is the intuitive difference between Linear Discriminant Analysis and a Linear Support Vector Machine?,https://www.quora.com/What-is-the-intuitive-difference-between-Linear-Discriminant-Analysis-and-a-Linear-Support-Vector-Machine?
Machine Learning,How do you train a non-linear support vector machine?,https://www.quora.com/How-do-you-train-a-non-linear-support-vector-machine?
Machine Learning,What are the advantages of support vector machines (SVM) compared with linear regression or logistic regression?,https://www.quora.com/What-are-the-advantages-of-support-vector-machines-(SVM)-compared-with-linear-regression-or-logistic-regression?
Machine Learning,How do I investigate the behavior of C in a soft margin linear support vector machine?,https://www.quora.com/How-do-I-investigate-the-behavior-of-C-in-a-soft-margin-linear-support-vector-machine?
Machine Learning,What are some applications of linear support vector machine?,https://www.quora.com/What-are-some-applications-of-linear-support-vector-machine?
Machine Learning,What are some examples of linear support vector machines (SVMs) in healthcare?,https://www.quora.com/What-are-some-examples-of-linear-support-vector-machines-(SVMs)-in-healthcare?
Machine Learning,How can they be used to solve medical problems?,https://www.quora.com/How-can-they-be-used-to-solve-medical-problems?
Machine Learning,"How do I convert a positive, negative training set to a set of points in a graph in linear support vector machines?","https://www.quora.com/How-do-I-convert-a-positive,-negative-training-set-to-a-set-of-points-in-a-graph-in-linear-support-vector-machines?"
Machine Learning,Support Vector Machines : How does going to higher dimension help data get linearly separable which was non linearly separable in actual dimension?,https://www.quora.com/Support-Vector-Machines-:-How-does-going-to-higher-dimension-help-data-get-linearly-separable-which-was-non-linearly-separable-in-actual-dimension?
Machine Learning,How can I solve non-linear kernel support vector machine (SVM) with CVX?,https://www.quora.com/How-can-I-solve-non-linear-kernel-support-vector-machine-(SVM)-with-CVX?
Machine Learning,What is the difference between kernelized and linear support vector machines (SVM)?,https://www.quora.com/What-is-the-difference-between-kernelized-and-linear-support-vector-machines-(SVM)?
Machine Learning,What are some Support Vector Machines materials where linear algebra is explained extremely well (from scratch)?,https://www.quora.com/What-are-some-Support-Vector-Machines-materials-where-linear-algebra-is-explained-extremely-well-(from-scratch)?
Machine Learning,What is the difference between linear support vector machines (SVM) and support vector machines (SVM)?,https://www.quora.com/What-is-the-difference-between-linear-support-vector-machines-(SVM)-and-support-vector-machines-(SVM)?
Machine Learning,How SVM ( support Vector Machine) worksHow can you use SVMs with non-linear data?,https://www.quora.com/How-SVM-(-support-Vector-Machine)-worksHow-can-you-use-SVMs-with-non-linear-data?
Machine Learning,What are the advantages and disadvantages of linear support vector machines (SVMs) and neural networks for binary classification problems in machine learning?,https://www.quora.com/What-are-the-advantages-and-disadvantages-of-linear-support-vector-machines-(SVMs)-and-neural-networks-for-binary-classification-problems-in-machine-learning?
Machine Learning,What are some applications where one would use linear support vector machines (SVMs) instead of neural networks?,https://www.quora.com/What-are-some-applications-where-one-would-use-linear-support-vector-machines-(SVMs)-instead-of-neural-networks?
Machine Learning,How do I determine weight from Support Vector Machine based on linear kernel?,https://www.quora.com/How-do-I-determine-weight-from-Support-Vector-Machine-based-on-linear-kernel?
Machine Learning,What is the basic math behind linear classifiers for support vector machines?,https://www.quora.com/What-is-the-basic-math-behind-linear-classifiers-for-support-vector-machines?
Machine Learning,What is the difference between a non-linear support vector machine (SVM) and a neural network in terms of solving classification problems?,https://www.quora.com/What-is-the-difference-between-a-non-linear-support-vector-machine-(SVM)-and-a-neural-network-in-terms-of-solving-classification-problems?
Machine Learning,What is the difference between kernelized and linear support vector machines (SVM)?,https://www.quora.com/What-is-the-difference-between-kernelized-and-linear-support-vector-machines-(SVM)?
Machine Learning,What are the advantages and disadvantages of linear and non-linear support vector machines (SVMs)?,https://www.quora.com/What-are-the-advantages-and-disadvantages-of-linear-and-non-linear-support-vector-machines-(SVMs)?
