Keyword,Title,Quora_link
Machine Learning,What's the difference between short term and long term memory?,https://www.quora.com/What's-the-difference-between-short-term-and-long-term-memory?
Machine Learning,What does ‘deep long short-term memory’ mean?,https://www.quora.com/What-does-‘deep-long-short-term-memory’-mean?
Machine Learning,What is the embedding layer in LSTM ( long short term memory )?,https://www.quora.com/What-is-the-embedding-layer-in-LSTM-(-long-short-term-memory-)?
Machine Learning,Why is my long term memory a lot better than my short term memory?,https://www.quora.com/Why-is-my-long-term-memory-a-lot-better-than-my-short-term-memory?
Machine Learning,What are the techniques to reinforce short term memory into long term memory?,https://www.quora.com/What-are-the-techniques-to-reinforce-short-term-memory-into-long-term-memory?
Machine Learning,How does sleep affect long-/short-term memory?,https://www.quora.com/How-does-sleep-affect-long-/short-term-memory?
Machine Learning,How does back propagation in bidirectional LSTM ( long short-term memory ) work?,https://www.quora.com/How-does-back-propagation-in-bidirectional-LSTM-(-long-short-term-memory-)-work?
Machine Learning,How does long short-term memory (LSTM) handle variable sequence length?,https://www.quora.com/How-does-long-short-term-memory-(LSTM)-handle-variable-sequence-length?
Machine Learning,What is long short-term memory (LSTM)?,https://www.quora.com/What-is-long-short-term-memory-(LSTM)?
Machine Learning,Is the long short term memory (LSTM) architecture in the neural network patented?,https://www.quora.com/Is-the-long-short-term-memory-(LSTM)-architecture-in-the-neural-network-patented?
Machine Learning,What's the objective function to minimize in long short-term memory (LSTM)?,https://www.quora.com/What's-the-objective-function-to-minimize-in-long-short-term-memory-(LSTM)?
Machine Learning,Why does the long short-term memory(LSTM) architecture in the neural network called so?,https://www.quora.com/Why-does-the-long-short-term-memory(LSTM)-architecture-in-the-neural-network-called-so?
Machine Learning,How does a long short-term memory (LSTM) handle variable dimensions (of inputs)?,https://www.quora.com/How-does-a-long-short-term-memory-(LSTM)-handle-variable-dimensions-(of-inputs)?
Machine Learning,Is Long short-term memory recurrent neural network supervised or unsupervised learning algorithm?,https://www.quora.com/Is-Long-short-term-memory-recurrent-neural-network-supervised-or-unsupervised-learning-algorithm?
Machine Learning,How long do short term memories last?,https://www.quora.com/How-long-do-short-term-memories-last?
Machine Learning,Is it possible to have terrible short-term memory and excellent long-term memory simultaneously?,https://www.quora.com/Is-it-possible-to-have-terrible-short-term-memory-and-excellent-long-term-memory-simultaneously?
Machine Learning,What causes short term memories to become long term memories?,https://www.quora.com/What-causes-short-term-memories-to-become-long-term-memories?
Machine Learning,What is a bidirectional long short-term memory?,https://www.quora.com/What-is-a-bidirectional-long-short-term-memory?
Machine Learning,How do I find the accuracy of a Long-short term memory Neural Network prediction model?,https://www.quora.com/How-do-I-find-the-accuracy-of-a-Long-short-term-memory-Neural-Network-prediction-model?
Machine Learning,How long does it take for a piece of information to transfer from the short-term memory to the long-term memory?,https://www.quora.com/How-long-does-it-take-for-a-piece-of-information-to-transfer-from-the-short-term-memory-to-the-long-term-memory?
