Keyword,Title,Quora_link
Machine Learning,How do I learn machine learning?,https://www.quora.com/How-do-I-learn-machine-learning?
Machine Learning,What is machine learning?,https://www.quora.com/What-is-machine-learning?
Machine Learning,Which are the best online courses for machine learning?,https://www.quora.com/Which-are-the-best-online-courses-for-machine-learning?
Machine Learning,I want to learn artificial intelligence and machine learning Where can I start?,https://www.quora.com/I-want-to-learn-artificial-intelligence-and-machine-learning-Where-can-I-start?
Machine Learning,What are some really interesting machine learning projects for beginners?,https://www.quora.com/What-are-some-really-interesting-machine-learning-projects-for-beginners?
Machine Learning,How do I learn mathematics for machine learning?,https://www.quora.com/How-do-I-learn-mathematics-for-machine-learning?
Machine Learning,What are the main differences between artificial intelligence and machine learning?,https://www.quora.com/What-are-the-main-differences-between-artificial-intelligence-and-machine-learning?
Machine Learning,Is machine learning a part of artificial intelligence?,https://www.quora.com/Is-machine-learning-a-part-of-artificial-intelligence?
Machine Learning,What is the difference between deep learning and usual machine learning?,https://www.quora.com/What-is-the-difference-between-deep-learning-and-usual-machine-learning?
Machine Learning,Is machine learning currently overhyped?,https://www.quora.com/Is-machine-learning-currently-overhyped?
Machine Learning,How does a total beginner start to learn machine learning if they have some knowledge of programming languages?,https://www.quora.com/How-does-a-total-beginner-start-to-learn-machine-learning-if-they-have-some-knowledge-of-programming-languages?
Machine Learning,What are prerequisites to start learning machine learning?,https://www.quora.com/What-are-prerequisites-to-start-learning-machine-learning?
Machine Learning,How can one become a good machine learning engineer?,https://www.quora.com/How-can-one-become-a-good-machine-learning-engineer?
Machine Learning,"What is the difference between Data Analytics, Data Analysis, Data Mining, Data Science, Machine Learning , and Big Data?","https://www.quora.com/What-is-the-difference-between-Data-Analytics,-Data-Analysis,-Data-Mining,-Data-Science,-Machine-Learning-,-and-Big-Data?"
Machine Learning,What are the possible careers in machine learning?,https://www.quora.com/What-are-the-possible-careers-in-machine-learning?
Machine Learning,What are some common machine learning interview questions?,https://www.quora.com/What-are-some-common-machine-learning-interview-questions?
Machine Learning,What are the best resources for learning how to use Python for Machine Learning/Data Science?,https://www.quora.com/What-are-the-best-resources-for-learning-how-to-use-Python-for-Machine-Learning/Data-Science?
Machine Learning,What's the difference between Machine Learning and AI?,https://www.quora.com/What's-the-difference-between-Machine-Learning-and-AI?
Machine Learning,What are some good books on machine learning?,https://www.quora.com/What-are-some-good-books-on-machine-learning?
Machine Learning,"What are the best, regularly updated machine learning blogs or resources available?","https://www.quora.com/What-are-the-best,-regularly-updated-machine-learning-blogs-or-resources-available?"
Machine Learning,Is upGrad by IIIT Bangalore (the specialization in AI and machine learning ) a good course to be pursued?,https://www.quora.com/Is-upGrad-by-IIIT-Bangalore-(the-specialization-in-AI-and-machine-learning-)-a-good-course-to-be-pursued?
Machine Learning,Which is your favorite Machine Learning algorithm?,https://www.quora.com/Which-is-your-favorite-Machine-Learning-algorithm?
Machine Learning,What skills are needed for machine learning jobs?,https://www.quora.com/What-skills-are-needed-for-machine-learning-jobs?
Machine Learning,What are the best graduate schools for studying machine learning?,https://www.quora.com/What-are-the-best-graduate-schools-for-studying-machine-learning?
Machine Learning,How does machine learning work?,https://www.quora.com/How-does-machine-learning-work?
Machine Learning,Is machine learning difficult to learn?,https://www.quora.com/Is-machine-learning-difficult-to-learn?
Machine Learning,Will deep learning make other machine learning algorithms obsolete?,https://www.quora.com/Will-deep-learning-make-other-machine-learning-algorithms-obsolete?
Machine Learning,What are some of the best research papers or books for Machine learning?,https://www.quora.com/What-are-some-of-the-best-research-papers-or-books-for-Machine-learning?
Machine Learning,How is machine learning related to AI?,https://www.quora.com/How-is-machine-learning-related-to-AI?
Machine Learning,What programming languages should I know if I want to go in machine learning?,https://www.quora.com/What-programming-languages-should-I-know-if-I-want-to-go-in-machine-learning?
Machine Learning,Is Andrew Ng's Machine Learning course still the best machine learning course available?,https://www.quora.com/Is-Andrew-Ng's-Machine-Learning-course-still-the-best-machine-learning-course-available?
Machine Learning,Why isn’t machine learning more widely used for medical diagnoses?,https://www.quora.com/Why-isn’t-machine-learning-more-widely-used-for-medical-diagnoses?
Machine Learning,What is machine learning in layman's terms?,https://www.quora.com/What-is-machine-learning-in-layman's-terms?
Machine Learning,What are some interesting possible applications of machine learning?,https://www.quora.com/What-are-some-interesting-possible-applications-of-machine-learning?
Machine Learning,Why is Python so popular in machine learning?,https://www.quora.com/Why-is-Python-so-popular-in-machine-learning?
Machine Learning,What should I learn first Machine learning or AI?,https://www.quora.com/What-should-I-learn-first-Machine-learning-or-AI?
Machine Learning,What is the future of machine learning?,https://www.quora.com/What-is-the-future-of-machine-learning?
Machine Learning,Is machine learning approaching its end?,https://www.quora.com/Is-machine-learning-approaching-its-end?
Machine Learning,What's new in the field?,https://www.quora.com/What's-new-in-the-field?
Machine Learning,What is the difference between statistics and machine learning?,https://www.quora.com/What-is-the-difference-between-statistics-and-machine-learning?
Machine Learning,What startups are hiring engineers with strengths in machine learning/NLP?,https://www.quora.com/What-startups-are-hiring-engineers-with-strengths-in-machine-learning/NLP?
Machine Learning,"What's the difference between machine learning , AI, and NLP?","https://www.quora.com/What's-the-difference-between-machine-learning-,-AI,-and-NLP?"
Machine Learning,How do you explain Machine Learning and Data Mining to non Computer Science people?,https://www.quora.com/How-do-you-explain-Machine-Learning-and-Data-Mining-to-non-Computer-Science-people?
Machine Learning,What is the difference between a data scientist and a machine learning engineer?,https://www.quora.com/What-is-the-difference-between-a-data-scientist-and-a-machine-learning-engineer?
Machine Learning,I have completed Andrew Ng's Coursera class on machine learning  What should I do next?,https://www.quora.com/I-have-completed-Andrew-Ng's-Coursera-class-on-machine-learning--What-should-I-do-next?
Machine Learning,What can I do next?,https://www.quora.com/What-can-I-do-next?
Machine Learning,"What is the difference between AI, Machine Learning , NLP, and Deep Learning?","https://www.quora.com/What-is-the-difference-between-AI,-Machine-Learning-,-NLP,-and-Deep-Learning?"
Machine Learning,How do I practice machine learning problems with python?,https://www.quora.com/How-do-I-practice-machine-learning-problems-with-python?
Machine Learning,How is machine learning used in cyber security?,https://www.quora.com/How-is-machine-learning-used-in-cyber-security?
Machine Learning,What does one need to know in machine learning?,https://www.quora.com/What-does-one-need-to-know-in-machine-learning?
Machine Learning,What are the best conferences and journals about machine learning?,https://www.quora.com/What-are-the-best-conferences-and-journals-about-machine-learning?
Machine Learning,What is machine learning algorithm?,https://www.quora.com/What-is-machine-learning-algorithm?
Machine Learning,How does Facebook use machine learning?,https://www.quora.com/How-does-Facebook-use-machine-learning?
Machine Learning,How can I start learning machine learning from scratch?,https://www.quora.com/How-can-I-start-learning-machine-learning-from-scratch?
Machine Learning,How important is machine learning when it comes to Data Science?,https://www.quora.com/How-important-is-machine-learning-when-it-comes-to-Data-Science?
Machine Learning,Is Machine Learning a good choice for a career?,https://www.quora.com/Is-Machine-Learning-a-good-choice-for-a-career?
Machine Learning,Why did you learn Machine Learning?,https://www.quora.com/Why-did-you-learn-Machine-Learning?
Machine Learning,What are currently the hot topics in machine learning research and in real applications?,https://www.quora.com/What-are-currently-the-hot-topics-in-machine-learning-research-and-in-real-applications?
Machine Learning,Which books are best for beginner in machine learning?,https://www.quora.com/Which-books-are-best-for-beginner-in-machine-learning?
Machine Learning,"What's the difference between the terms "" machine learning "", ""deep learning "", and ""AI""?","https://www.quora.com/What's-the-difference-between-the-terms-""-machine-learning-"",-""deep-learning-"",-and-""AI""?"
Machine Learning,What are some of the common applications of Machine Learning?,https://www.quora.com/What-are-some-of-the-common-applications-of-Machine-Learning?
Machine Learning,What are the top 10 data mining or machine learning algorithms?,https://www.quora.com/What-are-the-top-10-data-mining-or-machine-learning-algorithms?
Machine Learning,"In 2006, the IEEE Conference on Data Mining identified the 10 top algorithms Are these still valid?","https://www.quora.com/In-2006,-the-IEEE-Conference-on-Data-Mining-identified-the-10-top-algorithms-Are-these-still-valid?"
Machine Learning,What are the principles of machine learning?,https://www.quora.com/What-are-the-principles-of-machine-learning?
Machine Learning,How do you choose a machine learning algorithm?,https://www.quora.com/How-do-you-choose-a-machine-learning-algorithm?
