Keyword,Title,Quora_link
Machine Learning,Do we need regularized linear models?,https://www.quora.com/Do-we-need-regularized-linear-models?
Machine Learning,"What is the difference between linear factor models and regular linear regression with intuition (regression, PCA, linear model, nonparametric, factor analysis, statistics)?","https://www.quora.com/What-is-the-difference-between-linear-factor-models-and-regular-linear-regression-with-intuition-(regression,-PCA,-linear-model,-nonparametric,-factor-analysis,-statistics)?"
Machine Learning,"Why does each neuron have its own weights in deep learning, instead of sharing them with other neurons like regular linear models (eg, logistic regression)?","https://www.quora.com/Why-does-each-neuron-have-its-own-weights-in-deep-learning,-instead-of-sharing-them-with-other-neurons-like-regular-linear-models-(eg,-logistic-regression)?"
Machine Learning,"How do L1 regularization and L2 regularization compare in use for generalized linear models (neural networks, GLM)?","https://www.quora.com/How-do-L1-regularization-and-L2-regularization-compare-in-use-for-generalized-linear-models-(neural-networks,-GLM)?"
Machine Learning,Is there any way to use regularization on linear models other than Ridge or Lasso methods?,https://www.quora.com/Is-there-any-way-to-use-regularization-on-linear-models-other-than-Ridge-or-Lasso-methods?
Machine Learning,What is an L1 regularization term for a linear model?,https://www.quora.com/What-is-an-L1-regularization-term-for-a-linear-model?
Machine Learning,"How do you assess the quality and goodness of the fit of a lasso model ( linear model, residuals, lasso, goodness of fit, regularization, statistics)?","https://www.quora.com/How-do-you-assess-the-quality-and-goodness-of-the-fit-of-a-lasso-model-(-linear-model,-residuals,-lasso,-goodness-of-fit,-regularization,-statistics)?"
Machine Learning,"How do you generate binary outcome data where ridge or lasso outperforms simple logistic regression (r, generalized linear model, simulation, regularization, statistics)?","https://www.quora.com/How-do-you-generate-binary-outcome-data-where-ridge-or-lasso-outperforms-simple-logistic-regression-(r,-generalized-linear-model,-simulation,-regularization,-statistics)?"
Machine Learning,"What is cross-validation and why is it necessary when using regularization methods (ridge, L1, and Lasso) in a linear model?","https://www.quora.com/What-is-cross-validation-and-why-is-it-necessary-when-using-regularization-methods-(ridge,-L1,-and-Lasso)-in-a-linear-model?"
Machine Learning,What are the advantages and disadvantages of using LASSO over regular linear regression for feature selection and model building?,https://www.quora.com/What-are-the-advantages-and-disadvantages-of-using-LASSO-over-regular-linear-regression-for-feature-selection-and-model-building?
Machine Learning,"What is the difference between ridge and lasso regularization in a linear model (regression, classification)?","https://www.quora.com/What-is-the-difference-between-ridge-and-lasso-regularization-in-a-linear-model-(regression,-classification)?"
Machine Learning,"What are some standard interactions, transformations, or nonlinear terms that one ought to regularly consider including in a linear regression model?","https://www.quora.com/What-are-some-standard-interactions,-transformations,-or-nonlinear-terms-that-one-ought-to-regularly-consider-including-in-a-linear-regression-model?"
Machine Learning,What is regularization and how does it help to reduce overfitting in linear regression models?,https://www.quora.com/What-is-regularization-and-how-does-it-help-to-reduce-overfitting-in-linear-regression-models?
Machine Learning,Why does regularization penalize stronger and yield smaller weights?,https://www.quora.com/Why-does-regularization-penalize-stronger-and-yield-smaller-weights?
Machine Learning,Why is a model with stronger weights considered as more complex?,https://www.quora.com/Why-is-a-model-with-stronger-weights-considered-as-more-complex?
Machine Learning,What is the exhaustive list of non-linear statistical models used in regular practices apart from the non-linear regression and clustering?,https://www.quora.com/What-is-the-exhaustive-list-of-non-linear-statistical-models-used-in-regular-practices-apart-from-the-non-linear-regression-and-clustering?
Machine Learning,How can I modify linear discriminant analysis so as to get a regularized discriminant analysis model in Python?,https://www.quora.com/How-can-I-modify-linear-discriminant-analysis-so-as-to-get-a-regularized-discriminant-analysis-model-in-Python?
Machine Learning,"How do you model regularity of weak solutions to semi-linear elliptic pdes (analysis of pdes, Sobolev spaces, semi linear elliptic Pdes, mathematics)?","https://www.quora.com/How-do-you-model-regularity-of-weak-solutions-to-semi-linear-elliptic-pdes-(analysis-of-pdes,-Sobolev-spaces,-semi-linear-elliptic-Pdes,-mathematics)?"
Machine Learning,"As of 2023, does LG switch from an inverter linear compressor to a regular standard inverter compressor (model #LTCS20020W)?","https://www.quora.com/As-of-2023,-does-LG-switch-from-an-inverter-linear-compressor-to-a-regular-standard-inverter-compressor-(model-#LTCS20020W)?"
Machine Learning,What is the difference between lasso and ridge regularization in a linear regression model?,https://www.quora.com/What-is-the-difference-between-lasso-and-ridge-regularization-in-a-linear-regression-model?
Machine Learning,Why would one choose to use one over the other?,https://www.quora.com/Why-would-one-choose-to-use-one-over-the-other?
Machine Learning,How do I calculate the regularization term for a linear regression model?,https://www.quora.com/How-do-I-calculate-the-regularization-term-for-a-linear-regression-model?
Machine Learning,λ ∑ n j = 1 θ 2 j λ ∑ j = 1 n θ j 2?,https://www.quora.com/λ-∑-n-j-=-1-θ-2-j-λ-∑-j-=-1-n-θ-j-2?
