Keyword,Title,Quora_link
Supervised Learning,What is supervised learning?,https://www.quora.com/What-is-supervised-learning?
Supervised Learning,What is the difference between supervised and unsupervised learning algorithms?,https://www.quora.com/What-is-the-difference-between-supervised-and-unsupervised-learning-algorithms?
Supervised Learning,What is the difference between supervised learning and reinforcement learning?,https://www.quora.com/What-is-the-difference-between-supervised-learning-and-reinforcement-learning?
Supervised Learning,Is unsupervised learning a better approach than supervised learning models?,https://www.quora.com/Is-unsupervised-learning-a-better-approach-than-supervised-learning-models?
Supervised Learning,Is supervised learning commonly carried out after clustering?,https://www.quora.com/Is-supervised-learning-commonly-carried-out-after-clustering?
Supervised Learning,Is reinforcement learning the combination of unsupervised learning and supervised learning?,https://www.quora.com/Is-reinforcement-learning-the-combination-of-unsupervised-learning-and-supervised-learning?
Supervised Learning,How does deep learning solve semi-supervised learning?,https://www.quora.com/How-does-deep-learning-solve-semi-supervised-learning?
Supervised Learning,"In Kaggle, what are your feature engineering strategies if you have text data in supervised learning?","https://www.quora.com/In-Kaggle,-what-are-your-feature-engineering-strategies-if-you-have-text-data-in-supervised-learning?"
Supervised Learning,How do I understand convolution neural networks and deep convolution neural networks for unsupervised and supervised learning?,https://www.quora.com/How-do-I-understand-convolution-neural-networks-and-deep-convolution-neural-networks-for-unsupervised-and-supervised-learning?
Supervised Learning,Does Google self-automated car uses reinforcement or supervised learning?,https://www.quora.com/Does-Google-self-automated-car-uses-reinforcement-or-supervised-learning?
Supervised Learning,What are the best/most common supervised learning classification algorithms for time series data?,https://www.quora.com/What-are-the-best/most-common-supervised-learning-classification-algorithms-for-time-series-data?
Supervised Learning,How do I apply supervised learning methods to time series classification?,https://www.quora.com/How-do-I-apply-supervised-learning-methods-to-time-series-classification?
Supervised Learning,Does unlabeled data really help in semi-supervised learning?,https://www.quora.com/Does-unlabeled-data-really-help-in-semi-supervised-learning?
Supervised Learning,When is it advantageous to use Reinforcement Learning over Supervised Learning?,https://www.quora.com/When-is-it-advantageous-to-use-Reinforcement-Learning-over-Supervised-Learning?
Supervised Learning,What are some real-world applications of semi-supervised learning?,https://www.quora.com/What-are-some-real-world-applications-of-semi-supervised-learning?
Supervised Learning,What are the applications of supervised learning?,https://www.quora.com/What-are-the-applications-of-supervised-learning?
Supervised Learning,How can you use clustering for supervised learning?,https://www.quora.com/How-can-you-use-clustering-for-supervised-learning?
Supervised Learning,What's the relation between manifold learning and semi-supervised learning?,https://www.quora.com/What's-the-relation-between-manifold-learning-and-semi-supervised-learning?
Supervised Learning,What is the difference between supervised learning and reverse reinforcement learning?,https://www.quora.com/What-is-the-difference-between-supervised-learning-and-reverse-reinforcement-learning?
Supervised Learning,Is supervised learning used more?,https://www.quora.com/Is-supervised-learning-used-more?
Supervised Learning,What are the best supervised learning algorithms for sentiment analysis in text? I want to do text analysis to determine whether a news item is positive or negative for a given subject?,https://www.quora.com/What-are-the-best-supervised-learning-algorithms-for-sentiment-analysis-in-text?-I-want-to-do-text-analysis-to-determine-whether-a-news-item-is-positive-or-negative-for-a-given-subject?
Supervised Learning,Is supervised learning a special type of reinforcement learning?,https://www.quora.com/Is-supervised-learning-a-special-type-of-reinforcement-learning?
Supervised Learning,"What is the difference between semi-supervised learning , active learning and transfer learning?","https://www.quora.com/What-is-the-difference-between-semi-supervised-learning-,-active-learning-and-transfer-learning?"
Supervised Learning,Can self-supervised learning overtake supervised learning?,https://www.quora.com/Can-self-supervised-learning-overtake-supervised-learning?
Supervised Learning,"How do supervised learning , unsupervised learning , and reinforcement learning compare?","https://www.quora.com/How-do-supervised-learning-,-unsupervised-learning-,-and-reinforcement-learning-compare?"
Supervised Learning,Is self-supervised learning really effective?,https://www.quora.com/Is-self-supervised-learning-really-effective?
Supervised Learning,What are the different types of supervised learning?,https://www.quora.com/What-are-the-different-types-of-supervised-learning?
Supervised Learning,What is the difference between semi-supervised learning and hybrid supervised-unsupervised learning?,https://www.quora.com/What-is-the-difference-between-semi-supervised-learning-and-hybrid-supervised-unsupervised-learning?
Supervised Learning,What is self-supervised learning in machine learning?,https://www.quora.com/What-is-self-supervised-learning-in-machine-learning?
Supervised Learning,How is it different from supervised learning?,https://www.quora.com/How-is-it-different-from-supervised-learning?
Supervised Learning,Which feature extraction is better for supervised learning sentiment analysis?,https://www.quora.com/Which-feature-extraction-is-better-for-supervised-learning-sentiment-analysis?
Supervised Learning,Can GANs solve semi-supervised learning?,https://www.quora.com/Can-GANs-solve-semi-supervised-learning?
Supervised Learning,What is the difference between weakly-supervised and strongly-supervised learning?,https://www.quora.com/What-is-the-difference-between-weakly-supervised-and-strongly-supervised-learning?
Supervised Learning,Why are unsupervised and reinforcement learning harder than supervised learning?,https://www.quora.com/Why-are-unsupervised-and-reinforcement-learning-harder-than-supervised-learning?
Supervised Learning,What are some recent works in Deep Semi-supervised Learning?,https://www.quora.com/What-are-some-recent-works-in-Deep-Semi-supervised-Learning?
Supervised Learning,What are the advantages and disadvantages of a supervised learning machine?,https://www.quora.com/What-are-the-advantages-and-disadvantages-of-a-supervised-learning-machine?
Supervised Learning,"In a supervised learning problem, what are some effective techniques that can deal with highly imbalanced datasets?","https://www.quora.com/In-a-supervised-learning-problem,-what-are-some-effective-techniques-that-can-deal-with-highly-imbalanced-datasets?"
Supervised Learning,Which use cases are there in Blockchain for supervised learning?,https://www.quora.com/Which-use-cases-are-there-in-Blockchain-for-supervised-learning?
Supervised Learning,Did deep learning revolutionize clustering as it did for supervised learning?,https://www.quora.com/Did-deep-learning-revolutionize-clustering-as-it-did-for-supervised-learning?
Supervised Learning,What is Adaptive Boosting in supervised learning?,https://www.quora.com/What-is-Adaptive-Boosting-in-supervised-learning?
Supervised Learning,What is regression in supervised learning?,https://www.quora.com/What-is-regression-in-supervised-learning?
Supervised Learning,What are the most exciting areas of current research/applications in semi-supervised learning?,https://www.quora.com/What-are-the-most-exciting-areas-of-current-research/applications-in-semi-supervised-learning?
Supervised Learning,Is Autoencoder unsupervised or semi-supervised learning?,https://www.quora.com/Is-Autoencoder-unsupervised-or-semi-supervised-learning?
Supervised Learning,What is the difference between classical supervised learning and imitation learning?,https://www.quora.com/What-is-the-difference-between-classical-supervised-learning-and-imitation-learning?
Supervised Learning,What is cotraining in supervised learning?,https://www.quora.com/What-is-cotraining-in-supervised-learning?
Supervised Learning,"What is the difference between transfer learning , domain adaptation, multi-task learning and semi-supervised learning?","https://www.quora.com/What-is-the-difference-between-transfer-learning-,-domain-adaptation,-multi-task-learning-and-semi-supervised-learning?"
Supervised Learning,What is the difference between Inverse reinforcement Learning and supervised learning?,https://www.quora.com/What-is-the-difference-between-Inverse-reinforcement-Learning-and-supervised-learning?
Supervised Learning,How can you differentiate supervised learning vs unsupervised learning vs semi-supervised learning vs reinforcement learning with one example?,https://www.quora.com/How-can-you-differentiate-supervised-learning-vs-unsupervised-learning-vs-semi-supervised-learning-vs-reinforcement-learning-with-one-example?
Supervised Learning,Can we get a confidence interval for the output of a classifier in supervised learning?,https://www.quora.com/Can-we-get-a-confidence-interval-for-the-output-of-a-classifier-in-supervised-learning?
Supervised Learning,Is a genetic algorithm supervised learning?,https://www.quora.com/Is-a-genetic-algorithm-supervised-learning?
Supervised Learning,"So, why deep learning?","https://www.quora.com/So,-why-deep-learning?"
Supervised Learning,"Why is deep learning , all of a sudden, so important?","https://www.quora.com/Why-is-deep-learning-,-all-of-a-sudden,-so-important?"
Supervised Learning,"What makes it more desirable to learn than reinforcement, unsupervised, and supervised learning?","https://www.quora.com/What-makes-it-more-desirable-to-learn-than-reinforcement,-unsupervised,-and-supervised-learning?"
Supervised Learning,"What are the relations between machine learning , deep learning , supervised learning and unsupervised learning?","https://www.quora.com/What-are-the-relations-between-machine-learning-,-deep-learning-,-supervised-learning-and-unsupervised-learning?"
Supervised Learning,Is reinforcement learning considered a branch of semi-supervised learning?,https://www.quora.com/Is-reinforcement-learning-considered-a-branch-of-semi-supervised-learning?
Supervised Learning,Which is the original paper on supervised learning?,https://www.quora.com/Which-is-the-original-paper-on-supervised-learning?
Supervised Learning,What is the point of self-supervised learning (machine learning question)?,https://www.quora.com/What-is-the-point-of-self-supervised-learning-(machine-learning-question)?
Supervised Learning,Does more data always improve supervised learning?,https://www.quora.com/Does-more-data-always-improve-supervised-learning?
Supervised Learning,"Why can't we say ""GAN is supervised learning "" even though it has fake and non-fake labels?","https://www.quora.com/Why-can't-we-say-""GAN-is-supervised-learning-""-even-though-it-has-fake-and-non-fake-labels?"
Supervised Learning,Where are supervised learning techniques used?,https://www.quora.com/Where-are-supervised-learning-techniques-used?
Supervised Learning,Why do data scientists prefer to model time-series forecasting as a supervised learning problem?,https://www.quora.com/Why-do-data-scientists-prefer-to-model-time-series-forecasting-as-a-supervised-learning-problem?
Supervised Learning,"Are the networks, CNN and RNN, based on supervised learning or unsupervised learning?","https://www.quora.com/Are-the-networks,-CNN-and-RNN,-based-on-supervised-learning-or-unsupervised-learning?"
Supervised Learning,What is supervised learning in ai?,https://www.quora.com/What-is-supervised-learning-in-ai?
